0,1
"Zion Parish 1900, Rathfarnham ED, Dublin, South Dublin, Dublin 6, Leinster, Éire / Ireland","(53.3066985, -6.270915256211742)"
"Birmingham Motors, Dublin Road, Mullingar North Urban ED, The Municipal District of Mullingar — Kinnegad, County Westmeath, Leinster, N91 Y526, Éire / Ireland","(53.5255903, -7.3307624)"
"O'Connell Bridge, Royal Exchange A ED, Dublin, County Dublin, Leinster, D01 FA48, Éire / Ireland","(53.347265500000006, -6.259104274441249)"
"Liffey, North Dock B ED, Dublin, Dublin 1, Leinster, Éire / Ireland","(53.34418175, -6.205709937812916)"
"Anna Liffey Mills Road, Lucan North ED, Fingal, Dublin 15, Leinster, D15 AXP3, Éire / Ireland","(53.3774356, -6.4397016)"
"Westmoreland Street, Mansion House A ED, Dublin, Dublin 2, Leinster, D02 X984, Éire / Ireland","(53.3469351, -6.25911)"
"Jaguar Land Rover Ireland LTD - HQ, Naas Road, Newcastle ED, Saggart, South Dublin, County Dublin, Leinster, D22 W1H9, Éire / Ireland","(53.2917541, -6.4412767)"
"Lombard Street West, Wood Quay B ED, Dublin, Dublin 8, Leinster, D08 P3K4, Éire / Ireland","(53.3340425, -6.2727002)"
"Arnott Street, Wood Quay B ED, Dublin, Dublin 8, Leinster, D01 XTN5, Éire / Ireland","(53.3342258, -6.2696105)"
"Premier Inn, South Great George's Street, Royal Exchange B ED, Dublin, County Dublin, Leinster, D02 E062, Éire / Ireland","(53.341605099999995, -6.2648925510640385)"
"The Mansion House, 20, Dawson Street, Dublin, County Dublin, Leinster, D02 AF30, Éire / Ireland","(53.34025485, -6.258069357661135)"
"Harcourt Road, Saint Kevin's ED, Dublin, Dublin 2, Leinster, D02 FW64, Éire / Ireland","(53.3327418, -6.2623417)"
"Mullingar (Prospect Estate), Dublin Road, Mullingar North Urban ED, The Municipal District of Mullingar — Kinnegad, County Westmeath, Leinster, N91 Y526, Éire / Ireland","(53.5257559, -7.3301446)"
"Harrison's Cove, Skerries ED, Fingal, County Dublin, Leinster, K34 Y567, Éire / Ireland","(53.5827701, -6.1242523)"
"Dolphin's Barn, Ushers E ED, Dublin, County Dublin, Leinster, D08 N2X7, Éire / Ireland","(53.3334215, -6.2914261)"
"Holles Street, South Dock ED, Dublin, Dublin 2, Leinster, D02 FP40, Éire / Ireland","(53.3405656, -6.2459603)"
"The Irish Times, 24-28, Tara Street, Mansion House A ED, Dublin, County Dublin, Leinster, D02 TK71, Éire / Ireland","(53.3460932, -6.254914695002476)"
"Bank of Ireland, Mayne River Street, Northern Cross, Malahide Road, Priorswood C ED, Dublin, County Dublin, Leinster, D17 TX92, Éire / Ireland","(53.4053032, -6.1782009)"
"Dublin North City Poor Law Union, Santry, Ballymun C ED, Dublin, Dublin 9, Leinster, Éire / Ireland","(53.39964245, -6.258906878884627)"
"Grosvenor Court, Clontarf, Clontarf East C ED, Dublin, Dublin 3, Leinster, D03 WR23, Éire / Ireland","(53.3688346, -6.2003386)"
"Shelbourne Park, Hastings Street, Pembroke West A ED, Dublin, County Dublin, Leinster, D04 W5C3, Éire / Ireland","(53.34047855, -6.230197004709833)"
"The Glass Houses, 92, Georges Street Lower, Dun Laoghaire-West Central ED, Dún Laoghaire, Dún Laoghaire-Rathdown, County Dublin, Leinster, A96 VR66, Éire / Ireland","(53.2931895, -6.137926)"
"Dublin Castle, Castle Street, Royal Exchange A ED, Dublin, County Dublin, Leinster, D08 RK00, Éire / Ireland","(53.342597049999995, -6.267050881169273)"
"Burton Chambers, 19-22, Dame Street, Royal Exchange A ED, Dublin, County Dublin, Leinster, D02 E267, Éire / Ireland","(53.34394025, -6.264813698327105)"
"Westmoreland, Westmoreland Street, Mansion House A ED, Dublin, County Dublin, Leinster, D02 H950, Éire / Ireland","(53.346326, -6.2590268)"
"Goose Green Court, Drumcondra North A ED, Dublin, Dublin 9, Leinster, D09 C7F8, Éire / Ireland","(53.3802626, -6.2389146)"
"College Street, Mansion House A ED, Dublin, Dublin 2, Leinster, D02 HR67, Éire / Ireland","(53.3450327, -6.2589964)"
"Trinity, College Street, Mansion House A ED, Dublin, County Dublin, Leinster, D02 PX75, Éire / Ireland","(53.3453267, -6.2582748)"
"Abbey Street, Howth ED, Howth, Fingal, Dublin 13, Leinster, D13 A2T6, Éire / Ireland","(53.3872364, -6.0655199)"
"Mater Misericordiae University Hospital, North Circular Road, Inns Quay A ED, Dublin, County Dublin, Leinster, D01 C2F6, Éire / Ireland","(53.35914245, -6.266923313887272)"
"Sinn Féin, 44, Parnell Square West, Rotunda B ED, Dublin, County Dublin, Leinster, D01 R243, Éire / Ireland","(53.352598349999994, -6.264523001483406)"
"Richmond, Drumcondra South A ED, Dublin, County Dublin, Leinster, Éire / Ireland","(53.3677289, -6.245728212186524)"
"Lusk, Fingal, County Dublin, Leinster, Éire / Ireland","(53.52417235, -6.1715961579092165)"
"Babylon, 83, Camden Street Lower, Saint Kevin's ED, Dublin, County Dublin, Leinster, D02 DH36, Éire / Ireland","(53.3358202, -6.2654939)"
"B-C, Cork Little, Shankill-Shanganagh ED, Shankill, Dún Laoghaire-Rathdown, Dublin 18, Leinster, D18 NH77, Éire / Ireland","(53.2216504, -6.1179623)"
"Tallaght University Hospital, Belgard Square North, Springfield, Tallaght-Springfield ED, Tallaght, South Dublin, County Dublin, Leinster, D24 NR0A, Éire / Ireland","(53.2911931, -6.378828005980265)"
"Nassau Street, Mansion House A ED, Dublin, Dublin 2, Leinster, D02 CY95, Éire / Ireland","(53.3425374, -6.2561629)"
"Ennis Farm Ltd, Holywood ED, Fingal, County Dublin, Leinster, Éire / Ireland","(53.5666802, -6.3156601)"
"Bank of Ireland, Dublin Road, Annacotty, Ballysimon ED, The Metropolitan District of Limerick City, Limerick, County Limerick, Munster, V94 YD8P, Éire / Ireland","(52.667525, -8.5523906)"
"Lombard Street East, Mansion House A ED, Dublin, Dublin 2, Leinster, D01 KF84, Éire / Ireland","(53.3467801, -6.2480764)"
"Greenwich Court, Rathmines West F ED, Dublin, Dublin 6, Leinster, D06 E3E5, Éire / Ireland","(53.3230194, -6.266442)"
"Dunsink, Blanchardstown-Abbotstown ED, Fingal, County Dublin, Leinster, Éire / Ireland","(53.3876833, -6.339465683914002)"
"Tolka, Ballygall A ED, Dublin, County Dublin, Leinster, Éire / Ireland","(53.380363900000006, -6.287460759157822)"
"Fairview, Clontarf West D ED, Dublin, Dublin 3, Leinster, D03 Y013, Éire / Ireland","(53.3628457, -6.2366557)"
"The Coombe, The Liberties, Merchants Quay B ED, Dublin, Dublin 8, Leinster, D08 VY00, Éire / Ireland","(53.3398257, -6.2775196)"
"Empire, Ballyfermot Road, Ballyfermot B ED, Dublin, County Dublin, Leinster, D10 FA31, Éire / Ireland","(53.3424667, -6.3535255)"
"Park for 1916 Commemorative Harp and Flag, Dundrum, Ballinteer-Meadowmount ED, Dún Laoghaire-Rathdown, Dublin 16, Leinster, D16 V6P7, Éire / Ireland","(53.2864354, -6.2521869)"
"The Queen's, Castle Street, Dalkey-Coliemore ED, Dalkey, Dún Laoghaire-Rathdown, County Dublin, Leinster, A96 RD37, Éire / Ireland","(53.278133600000004, -6.105042303009286)"
"Brown Thomas, 88-95, Grafton Street, Royal Exchange B ED, Dublin, County Dublin, Leinster, D02 ET99, Éire / Ireland","(53.34240615, -6.2600029684984)"
"China Info, 157, Parnell Street, Rotunda A ED, Dublin, County Dublin, Leinster, D01 CK74, Éire / Ireland","(53.3531397, -6.260608)"
"Jaffa On the Quay, 10, Burgh Quay, Mansion House A ED, Dublin, County Dublin, Leinster, D02 XK70, Éire / Ireland","(53.347234, -6.2569062)"
"Duke Street, Dublin, Dublin 2, Leinster, D02 VN26, Éire / Ireland","(53.3418812, -6.2588955)"
"Combridge Fine Arts, 17, William Street South, Royal Exchange B ED, Dublin, County Dublin, Leinster, D02 HW58, Éire / Ireland","(53.3421187, -6.262802797031641)"
"National Gallery of Ireland, 89, Merrion Square West, Dublin, County Dublin, Leinster, D02 FR90, Éire / Ireland","(53.341108649999995, -6.252665930035885)"
"Boyne Court, Kimmage C ED, Dublin, Dublin 6W, Leinster, Éire / Ireland","(53.32804215, -6.277519862966775)"
"Grafton Street, Mansion House A ED, Dublin, Dublin 2, Leinster, D02 C671, Éire / Ireland","(53.3439527, -6.2592087)"
"Ailesbury Road, Ballsbridge, Pembroke East E ED, Dublin, Dublin 4, Leinster, D04 PV32, Éire / Ireland","(53.3194475, -6.2307826)"
"Clyde Road, Pembroke West B ED, Dublin, Dublin 4, Leinster, D04 RK20, Éire / Ireland","(53.3294328, -6.2364506)"
"Dublin, Dublin 1, Leinster, Éire / Ireland","(53.3498006, -6.2602964)"
"Phoenix, Belgard Square North, Springfield, Tallaght-Springfield ED, Tallaght, South Dublin, County Dublin, Leinster, D24 NR0A, Éire / Ireland","(53.291825, -6.3806466)"
"Clarke's City Arms, Prussia Street, Oxmantown, Arran Quay E ED, Dublin, County Dublin, Leinster, D07 E1RD, Éire / Ireland","(53.3560081, -6.288092517451522)"
"Portobello, Wood Quay B ED, Dublin, County Dublin, Leinster, Éire / Ireland","(53.3312645, -6.2688255)"
"Carlow Courthouse, Dublin Road, Carlow, Carlow Urban ED, The Municipal District of Carlow, County Carlow, Leinster, R93 XA03, Éire / Ireland","(52.839124350000006, -6.930067153260868)"
"Vintners Federation of Ireland, Castleside Drive, Rathfarnham Village ED, Rathfarnham, Rathfarnham C ED, Rathfarnham, South Dublin, County Dublin, Leinster, D14 K3T6, Éire / Ireland","(53.3003627, -6.28319)"
"Zinfandel, 54, Ailesbury Road, Simmonscourt, Pembroke East E ED, Dublin, County Dublin, Leinster, D04 A373, Éire / Ireland","(53.3199201, -6.22755733704615)"
"Luas Red Line, St James' Walk, Ushers F ED, Dublin, County Dublin, Leinster, D08 RF72, Éire / Ireland","(53.3378925, -6.297221)"
"Killiney, Station Road, Killiney North ED, Killiney, Dún Laoghaire-Rathdown, County Dublin, Leinster, A96 X997, Éire / Ireland","(53.2553845, -6.11304)"
"Moore Street, North City ED, Dublin, Dublin 1, Leinster, D01 HW54, Éire / Ireland","(53.3510254, -6.2633858)"
"Burgundy Beauty, Newtown Park, Stillorgan Park, Blackrock-Carysfort ED, Blackrock, Dún Laoghaire-Rathdown, County Dublin, Leinster, A94 DA33, Éire / Ireland","(53.2871321, -6.177236331123737)"
"Howth, Fingal, County Dublin, Leinster, D13 T1F3, Éire / Ireland","(53.3858337, -6.0651186)"
"Drumleck, Howth ED, Howth, Fingal, County Dublin, Leinster, D13 F3C1, Éire / Ireland","(53.3628439, -6.0799389)"
"Sutton, Fingal, County Dublin, Leinster, D13 A7X4, Éire / Ireland","(53.3893873, -6.1098089)"
"Howth, Fingal, County Dublin, Leinster, D13 T1F3, Éire / Ireland","(53.3858337, -6.0651186)"
"Henry Street, North City ED, Dublin, Dublin 1, Leinster, D01 F5P2, Éire / Ireland","(53.349537, -6.2619735)"
"Dawson, Dawson Street, Dublin, County Dublin, Leinster, D02 YX99, Éire / Ireland","(53.3420744, -6.2579465)"
"Duke Lane Upper, Dublin, Dublin 2, Leinster, D02 NY88, Éire / Ireland","(53.3414724, -6.2592883)"
"Brighton, Cornelscourt, Dún Laoghaire-Rathdown, Dublin 18, Leinster, Éire / Ireland","(53.25698335, -6.174926920759983)"
"Mexico to Rome, Wellington Quay, Royal Exchange A ED, Dublin, County Dublin, Leinster, D02 Y103, Éire / Ireland","(53.3457261, -6.2643978)"
"Molesworth Street, Dublin, Dublin 2, Leinster, D02 RF29, Éire / Ireland","(53.3408388, -6.2554178)"
"Molesworth Street, Dublin, Dublin 2, Leinster, D02 RF29, Éire / Ireland","(53.3408388, -6.2554178)"
"South Frederick Street, Dublin, Dublin 2, Leinster, D02 RF29, Éire / Ireland","(53.3415886, -6.2568191)"
"#52 Dorset Street, Frederick Street, Dorset Street Upper, Rotunda A ED, Dublin, County Dublin, Leinster, D01 K6W6, Éire / Ireland","(53.3567253, -6.2644666)"
"New York Hair, 20, Eden Quay, North City ED, Dublin, County Dublin, Leinster, D01 EK70, Éire / Ireland","(53.348194750000005, -6.256771619433922)"
"Annamore Court, Chapelizod ED, Dublin, Dublin 10, Leinster, Éire / Ireland","(53.345541100000005, -6.3505479793934)"
"Castle Road, Lucan-Esker Electoral Division, Lucan, South Dublin, County Dublin, Leinster, K78 X227, Éire / Ireland","(53.3469104, -6.4252835)"
"Mercer, Charlemont Street, Saint Kevin's ED, Dublin, County Dublin, Leinster, D02 Y993, Éire / Ireland","(53.3320544, -6.2623111)"
"Ballsbridge, Pembroke East E ED, Dublin, County Dublin, Leinster, D04 C7K6, Éire / Ireland","(53.3291947, -6.2313316)"
"National Library of Ireland, Kildare Street, Dublin, County Dublin, Leinster, D02 CY95, Éire / Ireland","(53.34109775, -6.254485944347109)"
